{
  "schema_version": "t033.postgresql.resolution.v1",
  "channel": "latest-stable",
  "release_status": "stable",
  "version": "99.4",
  "platform": "macos-arm64",
  "url": "https://get.enterprisedb.com/postgresql/postgresql-99.4-macos-arm64.dmg",
  "sha256": "bbbbbbbbbbbbbbbbbbbbbbbbbbbbbbbbbbbbbbbbbbbbbbbbbbbbbbbbbbbbbbbb",
  "metadata_signature_verified": true,
  "installer_signature_required": true,
  "prerelease": false
}
